set,collector_number,name,mana_cost,cmc,type_line,rarity,colors,score,gih_wr,iwd,oh_wr,gd_wr,ata,alsa,gih_games,my_eval,my_notes,oracle_text,scryfall_uri,image_url
msh,136,"Human Torch, Johnny Storm",{2}{R},3.0,Legendary Creature — Human Hero,uncommon,R,16.3,0.5282730514518594,-0.012038122522680883,0.4888888888888889,0.5559410234171726,6.325443786982248,4.630008012820513,1963,,,"Flying Whenever you draw a card, if you control another Hero, Human Torch deals 1 damage to target opponent. Power-up — {6}{R}: Put three +1/+1 counters on Human Torch. (Activate each power-up ability only once. Reduce the cost by his mana cost if he entered this turn.)",https://scryfall.com/card/msh/136/human-torch-johnny-storm?utm_source=api,https://cards.scryfall.io/small/front/8/f/8f8659f6-a793-4edc-8401-d9126840c1c2.jpg?1780413635
msh,152,"Speed, Young Avenger",{1}{R},2.0,Legendary Creature — Mutant Hero,uncommon,R,15.9,0.5281643472498343,-0.03531004027800533,0.5651537335285505,0.4975786924939467,8.75973597359736,6.1149889205444765,1509,,,"Haste Whenever you cast a noncreature spell, you may pay {1}. When you do, target creature with haste can't be blocked this turn except by creatures with haste.",https://scryfall.com/card/msh/152/speed-young-avenger?utm_source=api,https://cards.scryfall.io/small/front/d/1/d15d187b-dc5d-482d-a79a-b9b98193ad7a.jpg?1780919920
msh,153,Stark Industries Executive,{R},1.0,Creature — Human Advisor,common,R,15.6,0.5278021015761821,0.02665643872839163,0.5466531440162272,0.513482280431433,9.133695371088699,6.358360707023307,4568,,,"{2}, {T}: Create a Treasure token. (It's an artifact with ""{T}, Sacrifice this token: Add one mana of any color."")",https://scryfall.com/card/msh/153/stark-industries-executive?utm_source=api,https://cards.scryfall.io/small/front/7/0/709ffd07-706c-471f-b74d-4637afa11686.jpg?1780919927
msh,150,Repulsor Blast,{3}{R},4.0,Sorcery,common,R,14.1,0.5253197598538241,0.010257796078800285,0.4940944881889764,0.5459471174685739,6.563827248866619,4.808484000441875,7662,,,"Teamwork 2 (As an additional cost to cast this spell, you may tap any number of creatures you control with total power 2 or more.) Repulsor Blast deals 5 damage to target creature. If this spell was cast using teamwork, it also deals 2 damage to that creature's controller.",https://scryfall.com/card/msh/150/repulsor-blast?utm_source=api,https://cards.scryfall.io/small/front/8/3/837265b0-fc15-4d96-9d6b-fd1c78534262.jpg?1780919908
msh,160,"Wonder Man, Hollywood Hero",{3}{R}{R},5.0,Legendary Creature — Human Performer Hero,uncommon,R,13.3,0.5248313917841815,0.003414587830310012,0.5172910662824207,0.5304162219850587,7.092307692307692,4.990988480118915,1631,,,Flying Each power-up ability of permanents you control can be activated an additional time. Power-up — {5}{R}{R}: Put two +1/+1 counters on Wonder Man. (Activate each power-up ability only . . . once? Reduce the cost by his mana cost if he entered this turn.),https://scryfall.com/card/msh/160/wonder-man-hollywood-hero?utm_source=api,https://cards.scryfall.io/small/front/1/e/1ee52395-9523-4da1-9108-8ab79229fc7a.jpg?1780919959
msh,143,Loki Laufeyson,{1}{R},2.0,Legendary Creature — God Sorcerer Villain,uncommon,R,12.6,0.5242843357992923,-0.006921000074933459,0.5294117647058824,0.5207197382769901,5.444259567387687,4.289821371947997,3109,,,"{1}, {T}: When you next cast an instant or sorcery spell with mana value less than or equal to Loki's power this turn, copy that spell. You may choose new targets for the copy. Power-up — {4}{R}: Put two +1/+1 counters on Loki. (Activate each power-up ability only once. Reduce the cost by his mana cost if he entered this turn.)",https://scryfall.com/card/msh/143/loki-laufeyson?utm_source=api,https://cards.scryfall.io/small/front/5/3/53b795a7-11f8-423a-b021-f811007fc82f.jpg?1780919895
msh,144,Machinesmith Automaton,{2}{R},3.0,Artifact Creature — Robot Villain,common,R,10.7,0.5207449316360208,0.017292896752299836,0.5150812064965197,0.5246227164416203,9.29438202247191,6.550057135601828,4242,,,"Trample Whenever another artifact you control enters, put a +1/+1 counter on this creature.",https://scryfall.com/card/msh/144/machinesmith-automaton?utm_source=api,https://cards.scryfall.io/small/front/8/0/802e663e-9529-46da-8af4-eb9ca07971b1.jpg?1780919901
msh,128,Evil's Thrall,{2}{R},3.0,Sorcery,uncommon,R,7.4,0.5089820359281437,0.035714709195470484,,,9.82863041982106,6.573258426966292,668,,,"Gain control of target creature until end of turn. If you control a Villain with greater mana value than that creature, gain control of that creature until the end of your next turn instead. Untap that creature. It gains haste until end of turn.",https://scryfall.com/card/msh/128/evils-thrall?utm_source=api,https://cards.scryfall.io/small/front/3/1/310e30cd-b8c3-40ea-9d61-57c5c5fc2a0b.jpg?1780572818
msh,155,Team Tactics,{1}{R},2.0,Instant,uncommon,R,6.3,0.5048622366288493,-0.028025738705169223,,0.5223274695534507,8.777134587554269,5.949025364978387,1234,,,"Teamwork 1 (As an additional cost to cast this spell, you may tap any number of creatures you control with total power 1 or more.) Target creature gains double strike until end of turn. If this spell was cast using teamwork, that creature also gains trample until end of turn.",https://scryfall.com/card/msh/155/team-tactics?utm_source=api,https://cards.scryfall.io/small/front/d/b/db1c7a71-3d01-4f2a-9b25-2a19bb0d1a56.jpg?1780919939
msh,148,"Quicksilver, Brash Blur",{R},1.0,Legendary Creature — Mutant Hero,rare,R,5.2,0.5037037037037037,0.0010582010582009804,,,5.160087719298246,3.854184158970053,540,,,"If Quicksilver, Brash Blur is in your opening hand, you may begin the game with him on the battlefield. Haste Power-up — {4}{R}: Put a +1/+1 counter and a double strike counter on Quicksilver. (Activate each power-up ability only once. Reduce the cost by his mana cost if he entered this turn.)",https://scryfall.com/card/msh/148/quicksilver-brash-blur?utm_source=api,https://cards.scryfall.io/small/front/2/d/2d5819ca-165d-4f4c-9500-3ac206994880.jpg?1778243916
msh,158,Vision of Love,{1}{R},2.0,Instant,common,R,4.8,0.5034812880765883,0.010761235131518831,0.4684873949579832,0.5282317979197623,10.932471643365867,7.419303797468355,2298,,,"You may sacrifice an artifact or discard a card. If you do, draw two cards.",https://scryfall.com/card/msh/158/vision-of-love?utm_source=api,https://cards.scryfall.io/small/front/5/6/5604cee1-a2ea-48ed-88f4-6878bd053fc8.jpg?1780925917
msh,125,Blazing Crescendo,{1}{R},2.0,Instant,common,R,4.4,0.5030097817908201,-0.011414522523706339,0.48641304347826086,0.5148005148005148,10.7015326700726,7.2994728425042945,2658,,,"Target creature gets +3/+1 until end of turn. Exile the top card of your library. Until the end of your next turn, you may play that card.",https://scryfall.com/card/msh/125/blazing-crescendo?utm_source=api,https://cards.scryfall.io/small/front/8/4/8447c3d6-8c65-4d3c-81c4-609801602d06.jpg?1780919826
msh,154,Super Speed,{R},1.0,Enchantment — Aura,common,R,3.7,0.5026525198938993,0.0021830363258241725,,,11.934520390580126,8.066894931944876,754,,,"Flash Enchant creature When this Aura enters, enchanted creature gains first strike until end of turn. Enchanted creature gets +1/+0 and has haste.",https://scryfall.com/card/msh/154/super-speed?utm_source=api,https://cards.scryfall.io/small/front/2/a/2aa2e596-e5e0-4c60-8eea-14adda1cdaae.jpg?1780919933
msh,138,"Iron Fist, Living Weapon",{2}{R},3.0,Legendary Creature — Human Warrior Hero,uncommon,R,3.0,0.49725058915946585,-0.024465789699770202,0.5082266910420475,0.4889807162534435,7.836030964109782,5.596637228260869,1273,,,"Whenever you cast a spell that targets a creature you control, Iron Fist gains ""{T}: Iron Fist deals damage equal to his power to any other target"" until end of turn.",https://scryfall.com/card/msh/138/iron-fist-living-weapon?utm_source=api,https://cards.scryfall.io/small/front/5/c/5cc2d948-ac8b-4466-b604-3fabc0ab6bb9.jpg?1780413644
msh,159,Volcanic Villain,{2}{R},3.0,Creature — Elemental Villain,common,R,1.5,0.4773049645390071,-0.018965547643986447,0.4417808219178082,0.5024213075060533,11.281323877068559,7.576854667508176,1410,,,Haste Power-up — {5}{R}: Put two +1/+1 counters on this creature. (Activate each power-up ability only once. Reduce the cost by its mana cost if it entered this turn.),https://scryfall.com/card/msh/159/volcanic-villain?utm_source=api,https://cards.scryfall.io/small/front/4/f/4f48ba40-9934-40fd-a251-e15a68e772d2.jpg?1780919953
msh,127,Death to Our Enemies,{2}{R},3.0,Enchantment — Plan,uncommon,R,0.7,0.463855421686747,-0.04591020331325302,,0.4678111587982833,8.465885596140593,5.863050170563275,1162,,,"Whenever you cast a noncreature spell, create a tapped Treasure token and put a plan counter on this enchantment. When the fourth plan counter is put on this enchantment, sacrifice it. When you do, it deals 7 damage divided as you choose among one or two targets.",https://scryfall.com/card/msh/127/death-to-our-enemies?utm_source=api,https://cards.scryfall.io/small/front/f/2/f2a8f518-c0b5-4e15-aab2-49b5ef29fb41.jpg?1780572418
msh,134,Hire a Crew,{2}{R},3.0,Instant,common,R,0.4,0.457233368532207,-0.024533812393459198,,0.48073394495412847,11.778016085790885,8.05315859643151,947,,,"Create a 2/1 black Villain creature token with menace, then creatures you control get +1/+0 until end of turn. (A creature with menace can't be blocked except by two or more creatures.)",https://scryfall.com/card/msh/134/hire-a-crew?utm_source=api,https://cards.scryfall.io/small/front/5/0/50a6aa80-79a3-46f3-9cc1-5bf663b64976.jpg?1780919861
msh,133,Hex Magic,{2}{R},3.0,Sorcery — Arcane,uncommon,R,,,,,,10.714108910891088,7.350262448574266,435,,,"Exile all the cards from your hand, then draw that many cards. Until the end of your next turn, you may play cards exiled this way.",https://scryfall.com/card/msh/133/hex-magic?utm_source=api,https://cards.scryfall.io/small/front/2/5/259bed47-1950-43ae-8efd-3009537529a8.jpg?1780919855
msh,151,The Scarlet Witch,{2}{R},3.0,Legendary Creature — Mutant Warlock Hero,rare,R,,,,,,5.768421052631579,4.321438226547715,318,,,"Instant and sorcery spells you cast with mana value 4 or greater cost {X} less to cast, where X is The Scarlet Witch's power.",https://scryfall.com/card/msh/151/the-scarlet-witch?utm_source=api,https://cards.scryfall.io/small/front/4/0/407e8993-e56d-477d-ab85-d10a2522eab3.jpg?1780413670
msh,193,The Unbeatable Squirrel Girl,{1}{G}{G}{G},4.0,Legendary Creature — Squirrel Human Hero,rare,G,88.9,0.6134676564156946,0.06962833621484477,0.6071428571428571,0.6179673321234119,2.0559523809523808,2.1361607142857144,1886,,,"Do You Like Squirrels? — Whenever The Unbeatable Squirrel Girl enters or attacks, create a 1/1 green Squirrel creature token. I LOVE Squirrels! — {1}{G}{G}{G}: Create X 1/1 green Squirrel creature tokens, where X is the number of Squirrels you control.",https://scryfall.com/card/msh/193/the-unbeatable-squirrel-girl?utm_source=api,https://cards.scryfall.io/small/front/d/8/d8b94ebb-0b3a-4e68-8c0c-3a61ac32f3ef.jpg?1780413721
msh,188,"She-Hulk, Jade Defender",{3}{G},4.0,Legendary Creature — Gamma Hero,uncommon,G,87.4,0.6112830278505118,0.05373521364286149,0.5874780573434757,0.6276083467094703,4.614241803278689,3.7893606870229006,4201,,,"Reach, trample Power-up — {4}{G}{G}: Destroy up to one target artifact or enchantment. Put a +1/+1 counter on She-Hulk. (Activate each power-up ability only once. Reduce the cost by her mana cost if she entered this turn.)",https://scryfall.com/card/msh/188/she-hulk-jade-defender?utm_source=api,https://cards.scryfall.io/small/front/d/2/d22a8d02-023c-4f71-a771-16b5aa2a05d7.jpg?1780920100
msh,174,Ka-Zar of the Savage Land,{4}{G},5.0,Legendary Creature — Human Barbarian Hero,uncommon,G,84.4,0.6071692535107169,0.05309135963095035,0.5824125230202578,0.6237654320987654,3.0610526315789475,2.833967886111571,5412,,,"You may look at the top card of your library any time. You may play lands from the top of your library. When Ka-Zar enters, create Zabu, a legendary 2/2 green Cat creature token with ""Landfall — Whenever a land you control enters, put a +1/+1 counter on Zabu.""",https://scryfall.com/card/msh/174/ka-zar-of-the-savage-land?utm_source=api,https://cards.scryfall.io/small/front/c/a/caf70fc5-87a0-4b4d-bedd-74dd09569bed.jpg?1780658523
msh,180,Punishing Punch,{2}{G},3.0,Instant,uncommon,G,80.4,0.6009294807031723,0.049510013727506075,0.5753286147623863,0.6179737462133962,3.9304911955514363,3.3102581072137656,4949,,,This spell costs {2} less to cast if there are two or more creature cards in your graveyard. Target creature you control deals damage equal to twice its power to target creature an opponent controls.,https://scryfall.com/card/msh/180/punishing-punch?utm_source=api,https://cards.scryfall.io/small/front/a/3/a33a4cb4-1b57-47ca-8e5e-58ff46a6e0ce.jpg?1780657807
msh,194,Undercover Skrull,{1}{G},2.0,Creature — Skrull Shapeshifter Villain,common,G,76.7,0.5945899379738112,0.019963072302169427,0.6244,0.5720338983050848,5.2728147862918755,4.129271021602547,11608,,,"As long as there are two or more creature cards in your graveyard, this creature gets +2/+2 and is all creature types. {T}: Add one mana of any color.",https://scryfall.com/card/msh/194/undercover-skrull?utm_source=api,https://cards.scryfall.io/small/front/9/0/90b9a3c0-3fd6-403e-9d6c-201342fea0ad.jpg?1780920130
msh,168,Go Nuts!,{G},1.0,Sorcery,common,G,70.4,0.5849020361121783,0.02322011003554214,0.5708559302051402,0.594555177442878,6.2195809830781625,4.76166503869562,10412,,,"Teamwork 3 (As an additional cost to cast this spell, you may tap any number of creatures you control with total power 3 or more.) Choose one. If this spell was cast using teamwork, choose both instead. • Put a +1/+1 counter on target creature. • Target creature you control fights target creature an opponent controls.",https://scryfall.com/card/msh/168/go-nuts!?utm_source=api,https://cards.scryfall.io/small/front/1/5/152a7b5b-2d95-45d3-8fd9-0ca1d5a79f8b.jpg?1780413688
msh,165,Earth's Mightiest Heroes,{4}{G}{G},6.0,Sorcery,mythic,G,69.3,0.5839017735334243,0.0381790596691175,,,2.141643059490085,2.1974386339381002,733,,,"Teamwork 5 (As an additional cost to cast this spell, you may tap any number of creatures you control with total power 5 or more.) Reveal the top eight cards of your library. You may put a creature card from among them onto the battlefield. If this spell was cast using teamwork, put any number of creature cards from among them onto the battlefield instead. Put the rest into your graveyard.",https://scryfall.com/card/msh/165/earths-mightiest-heroes?utm_source=api,https://cards.scryfall.io/small/front/b/3/b38b9bd6-1dd7-4bbc-8a82-ce391c1172e1.jpg?1780658507
msh,196,"White Tiger, Ava Ayala",{1}{G},2.0,Legendary Creature — Human Hero,uncommon,G,67.8,0.5815033783783784,0.012073560415387541,0.5738354806739346,0.58719646799117,4.41709722874589,3.6723434876469176,4736,,,"Power-up — {5}{G}: Put a +1/+1 counter on White Tiger and create The Tiger God, a legendary 4/4 green Cat God creature token with ""The Tiger God can't be blocked by more than one creature."" (Activate each power-up ability only once. Reduce the cost by her mana cost if she entered this turn.)",https://scryfall.com/card/msh/196/white-tiger-ava-ayala?utm_source=api,https://cards.scryfall.io/small/front/c/1/c1589e2e-32a8-48b8-93eb-a9af344e7084.jpg?1781065378
msh,178,Pet Avengers,{3}{G},4.0,Creature — Dragon Cat Dog Bird Frog Hero,common,G,64.1,0.5777648934628207,0.00410931698238548,0.5556338028169014,0.593249568859325,8.935580204778157,6.3081342416726836,6899,,,Reach Power-up — {6}{G}: Put a +1/+1 counter on this creature and create a 3/2 white Hero creature token with vigilance. (Activate each power-up ability only once. Reduce the cost by its mana cost if it entered this turn.),https://scryfall.com/card/msh/178/pet-avengers?utm_source=api,https://cards.scryfall.io/small/front/1/0/108a0b92-2134-4776-a2f7-da92050f1b21.jpg?1780925689
msh,161,Ant-Man's Army,{2}{G},3.0,Creature — Insect,common,G,63.7,0.5772435459636661,0.011067802166097707,0.5708812260536399,0.5820004774409167,8.576199534982033,6.2949617746584785,7321,,,"When this creature enters, create a Food token or a Treasure token. (A Food token is an artifact with ""{2}, {T}, Sacrifice this token: You gain 3 life."" A Treasure token is an artifact with ""{T}, Sacrifice this token: Add one mana of any color."")",https://scryfall.com/card/msh/161/ant-mans-army?utm_source=api,https://cards.scryfall.io/small/front/6/1/61a89566-06c1-404f-8217-e5276e2dc5a2.jpg?1780919965
msh,170,"Hellcat, Undying Vigilante",{G}{G},2.0,Legendary Creature — Human Hero,uncommon,G,59.6,0.5717415115005476,0.023598979279167764,0.5977605512489234,0.5525982256020279,6.1259445843828715,4.59660089861301,2739,,,"Haste When Hellcat dies, return her to the battlefield under her owner's control with a +1/+1 counter on her. She loses all abilities and gains haste.",https://scryfall.com/card/msh/170/hellcat-undying-vigilante?utm_source=api,https://cards.scryfall.io/small/front/d/7/d7922c5f-d6ee-4b62-a537-3be5aa280e10.jpg?1780942695
msh,184,"Rick Jones, Destined Sidekick",{G},1.0,Legendary Creature — Human Advisor,uncommon,G,58.9,0.5714285714285714,0.03689942344650865,,,10.124431818181819,7.131894827093455,728,,,"{3}, {T}: Mill four cards. You may put a Hero or enchantment card from among those cards into your hand. (To mill four cards, put the top four cards of your library into your graveyard.)",https://scryfall.com/card/msh/184/rick-jones-destined-sidekick?utm_source=api,https://cards.scryfall.io/small/front/2/9/29bffd7c-73be-4185-976b-36a42a4512fe.jpg?1780920066
msh,166,Epic Fight,{2}{G},3.0,Sorcery,rare,G,57.0,0.5700655933214073,0.027881970492623198,0.5535444947209653,0.5808678500986193,2.3300852618757615,2.28464232116058,1677,,,Choose one or both — • Double target creature's power and toughness until end of turn. • Target creature you control fights target creature an opponent controls.,https://scryfall.com/card/msh/166/epic-fight?utm_source=api,https://cards.scryfall.io/small/front/d/5/d521b80b-4b0b-4d69-bd95-4c83feaf2145.jpg?1781065469
msh,172,Heroic Feast,{2}{G},3.0,Enchantment,rare,G,56.7,0.5698924731182796,0.03636756890372028,,,4.575174825174825,3.8100961538461537,744,,,"When this enchantment enters, create a Food token. (It's an artifact with ""{2}, {T}, Sacrifice this token: You gain 3 life."") Whenever you gain life, choose up to that many target creatures you control. Put a +1/+1 counter on each of them.",https://scryfall.com/card/msh/172/heroic-feast?utm_source=api,https://cards.scryfall.io/small/front/3/2/32d05c3d-cf03-492e-a956-2e77c36e36c4.jpg?1780919992
msh,181,Rapid Rescue,{G},1.0,Instant,common,G,54.8,0.5671981776765376,0.010900148942825538,0.5755627009646302,0.561014263074485,11.546146746654362,8.173341485784164,2195,,,"Mill two cards. You may put a permanent card from among the milled cards into your hand. You gain 2 life. (To mill two cards, put the top two cards of your library into your graveyard.)",https://scryfall.com/card/msh/181/rapid-rescue?utm_source=api,https://cards.scryfall.io/small/front/d/7/d739e636-681e-4423-84e3-91efd02b2c94.jpg?1780920054
msh,169,Guerrilla Gorilla,{1}{G},2.0,Creature — Ape Soldier Hero,common,G,51.1,0.5628415300546448,0.014390640140340194,0.5679694137638063,0.5589923469387755,9.162589572522856,6.367925968909385,5490,,,Reach Sacrifice this creature: Destroy target noncreature artifact or noncreature enchantment. Activate only as a sorcery.,https://scryfall.com/card/msh/169/guerrilla-gorilla?utm_source=api,https://cards.scryfall.io/small/front/a/f/af6bc9d2-5783-489a-8963-af65f54f4f17.jpg?1780919979
msh,186,Serpent Specialist,{G},1.0,Creature — Human Snake Villain,common,G,49.6,0.5613192938990399,0.01097847369566518,0.565028901734104,0.5585365853658537,8.547600913937547,5.931160711393307,6458,,,Deathtouch Power-up — {3}{G}: Put two +1/+1 counters on this creature. (Activate each power-up ability only once. Reduce the cost by its mana cost if it entered this turn.),https://scryfall.com/card/msh/186/serpent-specialist?utm_source=api,https://cards.scryfall.io/small/front/7/2/72727c2a-08a9-47bc-a5eb-cda52e21684b.jpg?1780920082
msh,177,"Mole Man, Moloid Master",{2}{G},3.0,Legendary Creature — Human Villain,rare,G,48.1,0.5605381165919282,0.02396853730390236,,0.5703245749613601,3.0792393026941363,2.9308026888098064,1115,,,"You may play lands from your graveyard. Landfall — Whenever a land you control enters, create a 1/1 green Minion creature token named Moloid with ""Whenever this token attacks, you may mill a card.""",https://scryfall.com/card/msh/177/mole-man-moloid-master?utm_source=api,https://cards.scryfall.io/small/front/1/b/1b406cc5-75c9-430a-83a2-de0f2a8aeae6.jpg?1780572872
msh,167,Giant Growth,{G},1.0,Instant,common,G,44.4,0.5556432517758485,0.02071209420318154,0.5152671755725191,0.5841184387617766,10.952747544465092,7.425682536919372,2534,,,Target creature gets +3/+3 until end of turn.,https://scryfall.com/card/msh/167/giant-growth?utm_source=api,https://cards.scryfall.io/small/front/f/d/fd1f95bf-48ea-455a-8a6c-0249b11c8900.jpg?1780919986
msh,195,Wakandan Royal Guard,{4}{G},5.0,Creature — Human Soldier Hero,common,G,42.2,0.554476597397553,-0.0011777863381522424,0.5385694249649369,0.56578073089701,9.373657838224768,6.497774913298346,5149,,,"Vigilance When this creature enters, put a +1/+1 counter on target creature. If that creature is another Hero, put two +1/+1 counters on it instead.",https://scryfall.com/card/msh/195/wakandan-royal-guard?utm_source=api,https://cards.scryfall.io/small/front/9/b/9bf0b1e9-32b5-4591-8dd2-6b5f9768c72d.jpg?1780920138
msh,191,"Tigra, Feline Fury",{1}{G},2.0,Legendary Creature — Cat Human Hero,uncommon,G,38.5,0.5511770726714432,0.0006321647420933774,0.5756853396901073,0.5327354260089686,7.6894409937888195,5.483378793044664,1954,,,"Flash Trample Whenever you gain life, put a +1/+1 counter on Tigra.",https://scryfall.com/card/msh/191/tigra-feline-fury?utm_source=api,https://cards.scryfall.io/small/front/7/3/73c11aea-4fa4-438d-b886-2fafa60c82f9.jpg?1780413713
msh,176,"Mister Hyde, Monster Within",{2}{G},3.0,Legendary Creature — Human Villain,uncommon,G,35.6,0.5494636471990465,0.005135916106609573,0.541871921182266,0.5550387596899224,4.635294117647059,3.6221573634926427,3356,,,"At the beginning of your upkeep, choose one — • Put a +1/+1 counter on Mister Hyde. • Remove a counter from a creature you control. If you do, draw a card.",https://scryfall.com/card/msh/176/mister-hyde-monster-within?utm_source=api,https://cards.scryfall.io/small/front/3/c/3cf30476-ed92-4dc2-86b7-2b5fd60a2de7.jpg?1780920005
msh,185,Savage Land Dinosaur,{4}{G}{G},6.0,Creature — Dinosaur,common,G,35.2,0.5491374803972817,-0.004633669588379297,0.5340250228867867,0.5604571428571429,8.489291958041958,6.011958762886598,7652,,,"Trample Basic landcycling {2} ({2}, Discard this card: Search your library for a basic land card, reveal it, put it into your hand, then shuffle.)",https://scryfall.com/card/msh/185/savage-land-dinosaur?utm_source=api,https://cards.scryfall.io/small/front/5/6/562bd376-3fba-4de0-b9fc-183004b03732.jpg?1780920074
msh,187,"Shang-Chi, Master of Kung Fu",{1}{G},2.0,Legendary Creature — Human Warrior Hero,mythic,G,34.8,0.54858934169279,0.010379734705890376,,,2.481707317073171,2.3038105046343977,638,,,You may activate abilities of creatures you control as though those creatures had haste. {T}: Add two mana of any one color. Spend this mana only to activate abilities of creature sources.,https://scryfall.com/card/msh/187/shang-chi-master-of-kung-fu?utm_source=api,https://cards.scryfall.io/small/front/2/e/2edbb62f-ad45-4422-850b-68dcc18b4c73.jpg?1780920091
msh,190,"The Thing, Ben Grimm",{5}{G},6.0,Legendary Creature — Human Hero,uncommon,G,34.1,0.5477941176470589,0.001829992086520793,0.5154004106776181,0.5691994572591588,6.391994478951001,4.6380933103936846,2448,,,"Trample Whenever one or more Heroes you control deal damage to a player, put two +1/+1 counters on The Thing.",https://scryfall.com/card/msh/190/the-thing-ben-grimm?utm_source=api,https://cards.scryfall.io/small/front/3/f/3f1933a8-046f-471a-afcf-cfb08ca0d239.jpg?1780413705
msh,182,"Reptil, Dinomorpher",{G},1.0,Legendary Creature — Human Hero,uncommon,G,33.0,0.5466461063993832,0.002956786011033663,0.5599284436493739,0.5365853658536586,8.710235131396956,5.878298286920517,1297,,,"Brontosaurus — {3}: Until end of turn, Reptil becomes a Dinosaur Hero with base power and toughness 3/5 and gains vigilance and reach. Tyrannosaurus Rex — {6}: Until end of turn, Reptil becomes a Dinosaur Hero with base power and toughness 6/6 and gains trample.",https://scryfall.com/card/msh/182/reptil-dinomorpher?utm_source=api,https://cards.scryfall.io/small/front/4/7/472db3f2-23df-46c1-86c6-f35fbe5ab4e3.jpg?1780539505
msh,171,"Hercules, Prince of Power",{2}{G},3.0,Legendary Creature — Demigod Warrior Hero,uncommon,G,31.5,0.5455720749838396,-0.02710905099677874,0.5346907993966817,0.5537330316742082,6.5449943757030375,4.79202332800301,3094,,,"Power-up — {4}{G}: Put a +1/+1 counter on Hercules. He gains vigilance, indestructible, and haste until end of turn. (Activate each power-up ability only once. Reduce the cost by his mana cost if he entered this turn.)",https://scryfall.com/card/msh/171/hercules-prince-of-power?utm_source=api,https://cards.scryfall.io/small/front/d/6/d610d9fe-f8ae-473f-9325-e2f28f7e8a69.jpg?1780544630
