set,collector_number,name,mana_cost,cmc,type_line,rarity,colors,score,gih_wr,iwd,oh_wr,gd_wr,ata,alsa,gih_games,my_eval,my_notes,oracle_text,scryfall_uri,image_url
msh,122,Widow's Bite,{1}{B},2.0,Instant,common,B,46.3,0.5583428354237933,0.02794307862184764,0.539,0.5702023298589822,6.394938198940554,4.816262588586349,10524,,,"Teamwork 3 (As an additional cost to cast this spell, you may tap any number of creatures you control with total power 3 or more.) Choose one. If this spell was cast using teamwork, choose both instead. • Target creature gains deathtouch until end of turn. • Target creature gets -2/-2 until end of turn.",https://scryfall.com/card/msh/122/widows-bite?utm_source=api,https://cards.scryfall.io/small/front/d/b/dbee18af-9ade-4251-81a1-f6e7ffbf480f.jpg?1780919813
msh,110,Red Room Recruit,{1}{B},2.0,Creature — Human Spy Villain,common,B,43.7,0.555376799322608,0.020085602614088427,0.5506970849176173,0.5585076314301866,7.132216014897579,5.348874099106866,11810,,,"When this creature enters, it connives. (Draw a card, then discard a card. If you discarded a nonland card, put a +1/+1 counter on this creature.)",https://scryfall.com/card/msh/110/red-room-recruit?utm_source=api,https://cards.scryfall.io/small/front/f/5/f52a5ba3-a618-4f52-9d33-ba85345eb627.jpg?1780919765
msh,121,"Whiplash, Vengeful Engineer",{B},1.0,Legendary Creature — Human Artificer Villain,uncommon,B,40.7,0.5540605478135512,0.04156054781355123,0.5761226725082147,0.5368150684931506,7.584502745576571,5.469940140539602,2081,,,"Whiplash enters tapped. Whenever Whiplash attacks, if he's equipped, each opponent loses X life and you gain X life, where X is the number of Equipment attached to him.",https://scryfall.com/card/msh/121/whiplash-vengeful-engineer?utm_source=api,https://cards.scryfall.io/small/front/6/f/6f6e6767-4d20-469c-9f4b-7286b8cc1979.jpg?1780919806
msh,116,"Swordsman, Sharp Scoundrel",{1}{B},2.0,Legendary Creature — Human Hero Villain,uncommon,B,39.3,0.5520833333333334,0.033522292384232766,0.555421686746988,0.5499219968798752,7.414319248826291,5.382256492067713,2112,,,"Whenever another Villain you control enters, attach up to one target Equipment you control to target creature you control. Whenever an equipped creature you control attacks, it connives. (Draw a card, then discard a card. If you discarded a nonland card, put a +1/+1 counter on that creature.)",https://scryfall.com/card/msh/116/swordsman-sharp-scoundrel?utm_source=api,https://cards.scryfall.io/small/front/6/5/6572aafe-18ed-4182-92e9-25f003f5fe3d.jpg?1780919780
msh,114,Stolen Stark Tech,{1}{B},2.0,Artifact — Equipment,common,B,38.9,0.5517241379310345,0.03463439177872585,0.5291637385804638,0.5657492354740061,9.920536379438788,6.810201166527794,3712,,,"Flash When this Equipment enters, attach it to target creature you control. That creature gains indestructible until end of turn. (Damage and effects that say ""destroy"" don't destroy it.) Equipped creature gets +1/+0. Equip {1} ({1}: Attach to target creature you control. Equip only as a sorcery.)",https://scryfall.com/card/msh/114/stolen-stark-tech?utm_source=api,https://cards.scryfall.io/small/front/d/b/db4557ad-4141-4dae-870e-a587506f4914.jpg?1780919774
msh,108,Ninja of the Hand,{2}{B},3.0,Creature — Human Ninja Villain,common,B,37.8,0.5510054844606947,0.030291935883369092,0.5261904761904762,0.5664688427299703,9.06430707876371,6.209915014164306,5470,,,Deathtouch Power-up — {4}{B}: Each opponent discards a card. Put a +1/+1 counter on this creature. (Activate each power-up ability only once. Reduce the cost by its mana cost if it entered this turn.),https://scryfall.com/card/msh/108/ninja-of-the-hand?utm_source=api,https://cards.scryfall.io/small/front/6/b/6b8116d8-2cc6-449b-a8b4-8a5166553497.jpg?1780919753
msh,112,"Ronin, Shadow Stalker",{2}{B},3.0,Legendary Creature — Human Rogue Hero,uncommon,B,33.3,0.5471847739888978,0.032416841499446236,0.5386100386100386,0.5531628532974427,8.687643020594965,6.194653235180163,1261,,,"Pay 2 life: Add two mana of any one color. Spend this mana only to cast Equipment spells or activate equip abilities. Activate only once each turn. {T}, Sacrifice an Equipment attached to Ronin: Target creature gets -4/-4 until end of turn. Activate only as a sorcery.",https://scryfall.com/card/msh/112/ronin-shadow-stalker?utm_source=api,https://cards.scryfall.io/small/front/f/7/f74b9794-946e-4ddc-93b2-5a321fc51fd0.jpg?1780572750
msh,113,Roxxon Brutes,{4}{B},5.0,Creature — Human Berserker Villain,common,B,32.6,0.5461414591849374,0.01985821861598258,0.5247124650295306,0.560337726523888,8.70112214069918,6.078960661741491,8073,,,"Menace (This creature can't be blocked except by two or more creatures.) Whenever you draw your second card each turn, put a +1/+1 counter on target creature. Basic landcycling {2} ({2}, Discard this card: Search your library for a basic land card, reveal it, put it into your hand, then shuffle.)",https://scryfall.com/card/msh/113/roxxon-brutes?utm_source=api,https://cards.scryfall.io/small/front/6/6/66550490-74e1-4bf1-8741-1266dfab3a03.jpg?1780572412
msh,96,Doom Reigns Supreme,{1}{B},2.0,Enchantment — Plan,rare,B,30.7,0.5442857142857143,0.04343585592877375,0.5654450261780105,0.5296251511487303,2.2844444444444445,2.2439024390243905,1400,,,"Whenever a Villain you control enters, each opponent loses 1 life and you gain 1 life. Put a plan counter on this enchantment. When the fifth plan counter is put on this enchantment, sacrifice it. When you do, target opponent exiles the top five cards of their library. You may cast up to two spells from among the exiled cards without paying their mana costs.",https://scryfall.com/card/msh/96/doom-reigns-supreme?utm_source=api,https://cards.scryfall.io/small/front/9/b/9b99894b-c774-45c2-9ee9-4d6a8e7522f5.jpg?1778243888
msh,109,Project Deathlok Soldier,{B},1.0,Artifact Creature — Zombie Soldier,common,B,22.6,0.5336705659184319,0.012926286310687374,0.5317149569303053,0.5349946977730647,10.551641504912533,7.2673619271445355,3163,,,{2}{B}: Return this card from your graveyard to your hand.,https://scryfall.com/card/msh/109/project-deathlok-soldier?utm_source=api,https://cards.scryfall.io/small/front/5/c/5c21a120-4ec7-46ec-974a-2204edb92abb.jpg?1780919759
msh,105,The Masters of Evil,{5}{B},6.0,Legendary Creature — Human Villain,uncommon,B,21.5,0.5331521739130435,0.02797938060465699,0.48150887573964496,0.5631443298969072,5.113495200451722,4.044161165490553,3680,,,"Other Villains you control get +2/+1. {1}{B}, Discard this card: Search your library for a Plan card, reveal it, put it into your hand, then shuffle.",https://scryfall.com/card/msh/105/the-masters-of-evil?utm_source=api,https://cards.scryfall.io/small/front/6/5/65ba4439-3282-4179-85b9-67a25e2e5d24.jpg?1780413609
msh,120,Visions of Villainy,{2}{B},3.0,Instant,common,B,21.1,0.5328320802005012,0.008633653098262806,0.5074050225370251,0.5490356996306934,8.122572291756581,5.806820805435535,7980,,,This spell costs {1} less to cast if you control a Villain. You draw two cards and lose 2 life.,https://scryfall.com/card/msh/120/visions-of-villainy?utm_source=api,https://cards.scryfall.io/small/front/f/8/f8f1e4f9-7415-437f-b694-ecbdd76db114.jpg?1780919799
msh,91,"Crossbones, Malicious Mercenary",{3}{B},4.0,Legendary Creature — Human Mercenary Villain,uncommon,B,20.7,0.5325779036827195,0.019409715938260574,0.5130081300813009,0.5449409347714432,4.539242219215156,3.662584353911522,3177,,,"Deathtouch Whenever another Villain you control enters, put a +1/+1 counter on Crossbones. He deals 2 damage to each opponent. This ability triggers only once each turn.",https://scryfall.com/card/msh/91/crossbones-malicious-mercenary?utm_source=api,https://cards.scryfall.io/small/front/1/5/1576148a-2371-49ba-8eef-0bc2ec3dcaf3.jpg?1780516520
msh,102,Kingpin's Enforcers,{2}{B},3.0,Creature — Human Villain,common,B,18.9,0.5299363057324841,0.012169808270555138,0.5138888888888888,0.5398625429553264,9.601378654623247,6.648795107774279,4710,,,"Lifelink {2}{B}, Sacrifice an artifact or creature: Draw a card.",https://scryfall.com/card/msh/102/kingpins-enforcers?utm_source=api,https://cards.scryfall.io/small/front/6/4/64056edb-6de2-4694-b771-f35542c25771.jpg?1780919735
msh,107,"Moonstone, Harsh Mistress",{3}{B},4.0,Legendary Creature — Human Doctor Villain,uncommon,B,17.4,0.5295013323182337,0.015430651689961494,0.46516613076098606,0.564935064935065,6.8714750542299345,5.164871361167987,2627,,,"Flying Whenever you discard a card, you may exile that card from your graveyard. If you do, until the end of your next turn, you may play that card.",https://scryfall.com/card/msh/107/moonstone-harsh-mistress?utm_source=api,https://cards.scryfall.io/small/front/1/a/1a1b2bd0-e17d-4b34-a8ee-7c913a6bc945.jpg?1781065603
msh,98,"Grim Reaper, Lethal Legionnaire",{3}{B},4.0,Legendary Creature — Human Villain,uncommon,B,16.7,0.5283198476915755,0.027744473698479988,0.48599269183922045,0.55546875,6.642156862745098,4.871292830405989,2101,,,"Whenever Grim Reaper attacks, you may pay {3}{B}. When you do, return target creature card from your graveyard to the battlefield tapped and attacking with a finality counter on it. (If a creature with a finality counter on it would die, exile it instead.)",https://scryfall.com/card/msh/98/grim-reaper-lethal-legionnaire?utm_source=api,https://cards.scryfall.io/small/front/4/b/4b1cedfe-4712-4602-a8a8-112bd54c9938.jpg?1780572391
msh,101,HYDRA Troopers,{2}{B},3.0,Creature — Human Soldier Villain,common,B,15.2,0.5276793018816471,0.009753097219788676,0.504039339655778,0.5426788500111434,8.167085953878408,5.934126495283172,7334,,,"When this creature enters, create a tapped 2/1 black Villain creature token with menace if there are two or more creature cards in your graveyard. Otherwise, mill two cards. (Put the top two cards of your library into your graveyard.)",https://scryfall.com/card/msh/101/hydra-troopers?utm_source=api,https://cards.scryfall.io/small/front/4/0/40c202f1-6e0d-42f4-a41e-e0be3362d585.jpg?1780572397
msh,119,Unliving Legionnaire,{3}{B},4.0,Creature — Vampire Villain,common,B,14.8,0.5260084925690022,0.012003788698999984,0.5010169491525424,0.5420846053205408,10.15478761699064,6.998573593652492,3768,,,Flying Power-up — {5}{B}{B}: Return up to one target creature card from your graveyard to your hand. Put two +1/+1 counters on this creature. (Activate each power-up ability only once. Reduce the cost by its mana cost if it entered this turn.),https://scryfall.com/card/msh/119/unliving-legionnaire?utm_source=api,https://cards.scryfall.io/small/front/c/e/ce08f4bb-7da3-4199-8b90-fcdb29e84e98.jpg?1780919793
msh,85,Agents of HYDRA,{1}{B},2.0,Creature — Human Spy Villain,common,B,11.1,0.5207456404088996,-0.008244127908164978,0.506990434142752,0.5302491103202847,8.582843713278496,6.066042591520299,6652,,,"When this creature dies, create a 2/1 black Villain creature token with menace. (It can't be blocked except by two or more creatures.)",https://scryfall.com/card/msh/85/agents-of-hydra?utm_source=api,https://cards.scryfall.io/small/front/8/5/857fef2e-df1f-4ec6-a262-f6fa52389cf9.jpg?1780919689
msh,117,Thunderbolts Conspiracy,{3}{B},4.0,Enchantment,rare,B,9.6,0.5188770571151985,0.01808841358207547,,0.5163690476190477,3.3156996587030716,3.1539670070699137,1033,,,"Flash Whenever a Villain you control dies, return it to the battlefield under its owner's control with a finality counter on it. That creature is a Hero in addition to its other types. (If a creature with a finality counter on it would die, exile it instead.)",https://scryfall.com/card/msh/117/thunderbolts-conspiracy?utm_source=api,https://cards.scryfall.io/small/front/f/4/f498c1a4-54d2-4e87-952f-8cf7e408930c.jpg?1778243910
msh,87,Baron Helmut Zemo,{B}{B}{B},3.0,Legendary Creature — Human Noble Villain,rare,B,9.3,0.5168539325842697,0.02720589945797569,,,4.606170598911071,3.631925726265349,801,,,"Whenever you cast a black spell from your hand, Baron Helmut Zemo connives. Boast — Exile any number of black cards from your graveyard with fifteen or more black mana symbols among their mana costs: Copy those exiled cards. You may cast up to three of the copies without paying their mana costs. (Activate only if this creature attacked this turn and only once each turn.)",https://scryfall.com/card/msh/87/baron-helmut-zemo?utm_source=api,https://cards.scryfall.io/small/front/c/2/c2aadc25-7755-4bc8-a8af-b01d27eec364.jpg?1778243806
msh,86,"Arnim Zola, Bio-Fanatic",{2}{B},3.0,Legendary Artifact Creature — Scientist Villain,uncommon,B,8.1,0.5127713920817369,0.00628798959211041,0.4768480909829407,0.5360336664913203,5.674691720493247,4.3911508101371,3132,,,"{3}, {T}: Create a tapped 2/1 black Villain creature token with menace. Activate only if there are two or more creature cards in your graveyard. (It can't be blocked except by two or more creatures.)",https://scryfall.com/card/msh/86/arnim-zola-bio-fanatic?utm_source=api,https://cards.scryfall.io/small/front/0/7/07c70df6-b064-424a-852e-201b312a5b54.jpg?1780919695
msh,90,Construct a Cosmic Cube,{2}{B},3.0,Enchantment — Plan,rare,B,7.0,0.5084473049074819,0.021362434058773416,,0.5201037613488976,3.15625,3.096,1243,,,"Whenever you draw your second card each turn, create a 2/1 black Villain creature token with menace and put a plan counter on this enchantment. When the seventh plan counter is put on this enchantment, sacrifice it. When you do, you control target opponent during their next turn. (You see all cards that player could see and make all decisions for them.)",https://scryfall.com/card/msh/90/construct-a-cosmic-cube?utm_source=api,https://cards.scryfall.io/small/front/4/4/448de757-ac16-4529-b851-1a1331b821a5.jpg?1780457773
msh,118,Too Evil to Stay Dead,{2}{B},3.0,Sorcery,uncommon,B,3.3,0.5024067388688327,-0.02571971394381256,0.49763779527559054,0.5053554040895814,8.425766871165644,5.9333387266402395,1662,,,"Teamwork 4 (As an additional cost to cast this spell, you may tap any number of creatures you control with total power 4 or more.) Choose target creature card in your graveyard with mana value 4 or less. If this spell was cast using teamwork, instead choose target creature card in your graveyard. Return the chosen card to the battlefield.",https://scryfall.com/card/msh/118/too-evil-to-stay-dead?utm_source=api,https://cards.scryfall.io/small/front/f/4/f471e9ce-73bb-4090-98f2-f591c7cf4efe.jpg?1780919786
msh,111,Robot Domination,{3}{B},4.0,Enchantment — Plan,uncommon,B,2.6,0.49283667621776506,-0.02820709482600603,0.4792843691148776,0.5011560693641619,6.20968629609246,4.717520741825281,2792,,,"Whenever one or more creature cards are put into your graveyard from anywhere, you draw a card, lose 1 life, and put a plan counter on this enchantment. When the third plan counter is put on this enchantment, sacrifice it and create three 2/2 colorless Robot Villain artifact creature tokens.",https://scryfall.com/card/msh/111/robot-domination?utm_source=api,https://cards.scryfall.io/small/front/b/2/b26bb968-6612-43fe-9147-a3d4786cbc20.jpg?1780572404
msh,94,Decoy Ploy,{1}{B},2.0,Instant,common,B,2.2,0.4891659246067082,-0.03748410941461183,0.4408770555990603,0.518642447418738,10.284576888080073,7.157523787149066,3369,,,Choose one or both — • Return target Villain card from your graveyard to your hand. • Return target Hero card from your graveyard to your hand.,https://scryfall.com/card/msh/94/decoy-ploy?utm_source=api,https://cards.scryfall.io/small/front/d/8/d8719b74-48ef-4f68-b59a-949edd644ddc.jpg?1780919716
msh,156,"Thor, God of Thunder",{3}{R}{R},5.0,Legendary Creature — God Warrior Hero,mythic,R,92.6,0.6238532110091743,0.12931080966576547,,0.6571969696969697,1.3651960784313726,1.3783783783783783,872,,,"Flying When Thor enters, exile target Equipment, instant, or sorcery card from your graveyard. Until the end of your next turn, you may play that card. Whenever you cast a noncreature spell, Thor deals damage equal to that spell's mana value to any target.",https://scryfall.com/card/msh/156/thor-god-of-thunder?utm_source=api,https://cards.scryfall.io/small/front/c/d/cddd314c-c271-475a-b076-01a8599c8015.jpg?1780413681
msh,146,"Mjölnir, Hammer of Thor",{3}{R},4.0,Legendary Artifact — Equipment,mythic,R,90.4,0.6173814898419865,0.08751135997185666,,0.6424682395644283,1.4808612440191387,1.5329052969502408,886,,,"When Mjölnir enters, it deals 4 damage to up to one target creature. Double all damage equipped creature would deal. Equip worthy {1} (A creature is worthy if it's a legendary non-Villain that's red and/or white.) {2}{R}, Discard this card: It deals 2 damage to each creature.",https://scryfall.com/card/msh/146/mj%C3%B6lnir-hammer-of-thor?utm_source=api,https://cards.scryfall.io/small/front/e/0/e0c7f566-5351-44e3-a346-b84b0eb10209.jpg?1780526037
msh,130,"Hawkeye, Master Marksman",{1}{R},2.0,Legendary Creature — Human Archer Hero,rare,R,74.4,0.5913846153846154,0.06809694415173873,0.6,0.5850267379679145,1.869960988296489,1.9072356215213357,1625,,,"First strike, reach Trick Arrows — Whenever Hawkeye becomes tapped, you may pay {1} up to three times. When you do, choose up to that many. • Net — Target creature can't block this turn. • Explosive — Hawkeye deals 2 damage to target player. • Boomerang — Discard a card, then draw a card.",https://scryfall.com/card/msh/130/hawkeye-master-marksman?utm_source=api,https://cards.scryfall.io/small/front/9/9/9991b684-0ae0-4aa4-8f22-a9c473f5d69c.jpg?1780572843
msh,139,"Jessica Jones, Private Eye",{2}{R},3.0,Legendary Creature — Human Detective Hero,uncommon,R,73.3,0.5889621087314663,0.04313891327323427,0.5942782834850455,0.5850760456273765,6.383370786516854,5.01301775147929,3642,,,"{T}, Put a stun counter on Jessica Jones: Exile the top X cards of your library, where X is Jessica Jones's power. You may play those cards this turn. (If a permanent with a stun counter would become untapped, remove one from it instead.)",https://scryfall.com/card/msh/139/jessica-jones-private-eye?utm_source=api,https://cards.scryfall.io/small/front/b/4/b48278fd-1d95-4ad6-9a51-f1c5a2ab9f4b.jpg?1780572425
msh,147,Photon Blast Barrage,{X}{R}{R},2.0,Sorcery,uncommon,R,58.5,0.5709859154929577,0.03324430816844093,0.5170257123002084,0.6077688299384179,5.707100591715976,4.625875160240607,3550,,,"When you cast this spell, copy it X times. You may choose new targets for the copies. Photon Blast Barrage deals 1 damage to target creature.",https://scryfall.com/card/msh/147/photon-blast-barrage?utm_source=api,https://cards.scryfall.io/small/front/f/8/f85a77d2-e11e-44bc-a1e7-d783cd49d714.jpg?1780413661
msh,142,Lightning Strike,{1}{R},2.0,Instant,common,R,50.0,0.5617341159509834,0.02925195297689409,0.5543779964673228,0.5668058455114823,3.971014492753623,3.1901102572669564,9711,,,Lightning Strike deals 3 damage to any target.,https://scryfall.com/card/msh/142/lightning-strike?utm_source=api,https://cards.scryfall.io/small/front/8/8/88b13bc0-da54-4c3b-917c-7c8345a329f5.jpg?1780919889
msh,135,HULK SMASH!,{1}{R},2.0,Instant,common,R,48.9,0.5610412926391383,0.03534789337016386,0.5440263061746438,0.5728401317456296,7.0566421132842265,5.126855840780432,6684,,,"Teamwork 4 (As an additional cost to cast this spell, you may tap any number of creatures you control with total power 4 or more.) Choose one. If this spell was cast using teamwork, choose both instead. • Destroy target noncreature artifact. • Target creature you control deals damage equal to its power to target creature an opponent controls.",https://scryfall.com/card/msh/135/hulk-smash!?utm_source=api,https://cards.scryfall.io/small/front/3/7/374ffb3e-0753-4682-936a-ae6921ace475.jpg?1780413626
msh,124,Avengers Disassembled,{1}{R}{R},3.0,Sorcery,rare,R,45.6,0.5560693641618497,0.04867636805290032,,,3.5200617283950617,3.1406135865595326,865,,,"Choose one or both — • Avengers Disassembled deals 3 damage to each creature. • Destroy target land. Its controller may search their library for a basic land card, put it onto the battlefield tapped, then shuffle.",https://scryfall.com/card/msh/124/avengers-disassembled?utm_source=api,https://cards.scryfall.io/small/front/7/2/72d3e750-870b-497d-80d7-e3df097db554.jpg?1780572805
msh,126,Crimson Operative,{3}{R},4.0,Artifact Creature — Human Villain,common,R,34.4,0.5481436764261998,0.02014367642619974,0.5305651672433679,0.5595031055900621,8.43850626118068,6.143828219299918,6626,,,"Prowess (Whenever you cast a noncreature spell, this creature gets +1/+1 until end of turn.) When this creature enters, exile the top card of your library. Until the end of your next turn, you may play that card.",https://scryfall.com/card/msh/126/crimson-operative?utm_source=api,https://cards.scryfall.io/small/front/c/4/c4bc077c-f220-47a5-aaf4-5324ca23d0c5.jpg?1780919833
msh,132,Hawkeye's Bow,{R},1.0,Artifact — Equipment,common,R,32.2,0.5457914240338804,0.031886662129118504,0.5533249686323714,0.5402930402930403,10.660076718796105,7.171709010383936,1889,,,"Equipped creature gets +1/+0 and has reach. Whenever equipped creature becomes tapped, it deals 1 damage to each opponent. Equip {1} ({1}: Attach to target creature you control. Equip only as a sorcery.)",https://scryfall.com/card/msh/132/hawkeyes-bow?utm_source=api,https://cards.scryfall.io/small/front/4/8/485be72b-d784-4886-bb3a-48cff8f781c6.jpg?1780919849
msh,145,"Misty Knight, Hero for Hire",{1}{R},2.0,Legendary Creature — Human Detective Hero,uncommon,R,29.3,0.5424048247267245,-0.0205940350224203,0.5679785330948122,0.5237785016286645,7.916575790621592,5.7375771354335825,2653,,,"{2}, {T}, Discard a card: Draw a card for each card you've discarded this turn.",https://scryfall.com/card/msh/145/misty-knight-hero-for-hire?utm_source=api,https://cards.scryfall.io/small/front/6/b/6b963642-a103-44a0-9eb7-9c3fdde181b7.jpg?1780657800
msh,131,"Hawkeye, Young Avenger",{3}{R},4.0,Legendary Creature — Human Archer Hero,uncommon,R,27.4,0.5405811623246493,0.013207634951121872,0.5349127182044888,0.5443886097152428,6.669137466307277,4.984155769781426,1996,,,"Reach If a source you control would deal noncombat damage to an opponent or a permanent an opponent controls, instead it deals that much damage plus X, where X is Hawkeye's power.",https://scryfall.com/card/msh/131/hawkeye-young-avenger?utm_source=api,https://cards.scryfall.io/small/front/3/c/3cebccbb-dde2-41fe-bfdc-0a46ee185749.jpg?1780919842
msh,141,Kree Sentinel,{4}{R},5.0,Artifact Creature — Kree Robot Villain,common,R,27.0,0.5394246534505888,0.0018618540581363252,0.5213613323678494,0.5520648593868761,8.867660764212488,6.202958451163802,6709,,,"Reach Basic landcycling {2} ({2}, Discard this card: Search your library for a basic land card, reveal it, put it into your hand, then shuffle.)",https://scryfall.com/card/msh/141/kree-sentinel?utm_source=api,https://cards.scryfall.io/small/front/b/a/ba5e441d-d036-4080-9571-6cf76df7b452.jpg?1780919882
msh,157,Truck Toss,{2}{R}{R},4.0,Instant,uncommon,R,23.0,0.5342422320862397,-0.011983966583179906,0.5056726094003241,0.5526041666666667,5.796821793416572,4.4402234636871505,3154,,,This spell costs {2} less to cast if you control a Vehicle. Truck Toss deals 4 damage to any target.,https://scryfall.com/card/msh/157/truck-toss?utm_source=api,https://cards.scryfall.io/small/front/6/0/60f02fbf-1416-48a3-bf94-f27509f6983a.jpg?1781065584
msh,129,Fin Fang Foom,{2}{R}{R},4.0,Legendary Creature — Alien Dragon Villain,rare,R,21.9,0.5333882934872217,0.00014021164578947864,,0.5308310991957105,2.900900900900901,2.783673469387755,1213,,,"Flying Whenever you cast an instant or sorcery spell that targets an artifact or land, copy that spell. You may choose new targets for the copy. Put two +1/+1 counters on Fin Fang Foom.",https://scryfall.com/card/msh/129/fin-fang-foom?utm_source=api,https://cards.scryfall.io/small/front/7/7/7777fac1-7bf5-4454-960d-26ec3183e392.jpg?1780572831
msh,137,HYDRA Assault Robot,{1}{R},2.0,Artifact Creature — Robot Villain,common,R,19.6,0.5306215030999546,0.01780099027944182,0.5343456254519161,0.5279438523524824,7.827843540916109,5.628351147713334,6613,,,"Whenever another Villain and/or artifact you control enters, this creature deals 1 damage to target opponent.",https://scryfall.com/card/msh/137/hydra-assault-robot?utm_source=api,https://cards.scryfall.io/small/front/e/3/e3b23fff-7d3b-4341-b556-82136f8c113b.jpg?1780919868
msh,149,Red Hulk,{4}{R}{R},6.0,Legendary Creature — Gamma Berserker Villain,uncommon,R,18.5,0.5298677610579116,0.026296332486483,0.5252643948296122,0.5327868852459017,5.322248614410134,4.033736327000575,2193,,,"Reach, trample Enrage — Whenever Red Hulk is dealt damage, put a +1/+1 counter on him. When you do, he deals damage equal to the number of +1/+1 counters on him to any other target.",https://scryfall.com/card/msh/149/red-hulk?utm_source=api,https://cards.scryfall.io/small/front/e/2/e25468e2-17c6-47b2-8eb6-fcb8ae6f4c17.jpg?1780658474
msh,140,K'un-Lun Warrior,{1}{R},2.0,Creature — Human Warrior Hero,common,R,17.8,0.5296946381341668,-0.005710354224467862,0.5415986949429038,0.5202586206896552,10.06217870257038,7.048675943867066,4159,,,"When this creature enters, you may sacrifice an artifact or discard a card. If you do, draw a card.",https://scryfall.com/card/msh/140/kun-lun-warrior?utm_source=api,https://cards.scryfall.io/small/front/e/6/e6e8359d-12be-49be-8cbe-6a3b8506a9e6.jpg?1780919875
