set,collector_number,name,mana_cost,cmc,type_line,rarity,colors,score,gih_wr,iwd,oh_wr,gd_wr,ata,alsa,gih_games,my_eval,my_notes,oracle_text,scryfall_uri,image_url
msh,175,Knight of Wundagore,{1}{G},2.0,Creature — Cat Knight Villain,common,G,26.7,0.5385365853658537,-0.01035080505896091,0.543827611395179,0.5342907385697538,8.628464419475655,6.001480480190532,6150,,,"Trample Whenever you put a +1/+1 counter on another creature, put a +1/+1 counter on this creature. This ability triggers only once each turn.",https://scryfall.com/card/msh/175/knight-of-wundagore?utm_source=api,https://cards.scryfall.io/small/front/f/3/f3003766-9383-44e0-8b51-35ccbed137ed.jpg?1780920020
msh,164,"Doc Samson, Super Psychiatrist",{4}{G},5.0,Legendary Creature — Gamma Doctor Hero,uncommon,G,24.4,0.5354025218234724,0.003208040877348828,0.5138055222088835,0.5500406834825061,6.775538568450313,4.858824655436448,2062,,,"If you would put one or more counters on a permanent you control, put that many plus one of each of those kinds of counters on that permanent instead. {T}: Add X mana of any one color, where X is Doc Samson's power.",https://scryfall.com/card/msh/164/doc-samson-super-psychiatrist?utm_source=api,https://cards.scryfall.io/small/front/1/9/19dc5fcc-d05d-41a0-84c5-2dec996f3e4f.jpg?1780539531
msh,173,"Hulkling, Burgeoning Bruiser",{2}{G},3.0,Legendary Creature — Kree Skrull Hero,uncommon,G,23.3,0.534400692340978,-0.00351188571432981,0.533462657613967,0.53515625,6.478580990629183,4.686177441273539,2311,,,"Vigilance Whenever another creature you control enters, if it has greater power or toughness than Hulkling, put a +1/+1 counter on Hulkling.",https://scryfall.com/card/msh/173/hulkling-burgeoning-bruiser?utm_source=api,https://cards.scryfall.io/small/front/9/0/9018477f-a67b-4fa4-8661-11ab91fae863.jpg?1780919998
msh,197,World War Hulk,{3}{G}{G},5.0,Enchantment — Saga,rare,G,20.4,0.5324149108589952,0.0010139446754202641,0.5178236397748592,0.543509272467903,2.4816983894582725,2.4279454722492697,1234,,,"(As this Saga enters and after your draw step, add a lore counter. Sacrifice after III.) I — The next red or green creature spell you cast this turn can be cast without paying its mana cost. II — Put three +1/+1 counters on target creature you control. III — Choose target creature you control. Until end of turn, double its power and toughness and it gains trample.",https://scryfall.com/card/msh/197/world-war-hulk?utm_source=api,https://cards.scryfall.io/small/front/9/0/9032f05b-5c21-4996-90c1-268dc6dffbaa.jpg?1778243944
msh,192,Training Regimen,{3}{G},4.0,Enchantment,uncommon,G,17.0,0.5291103865859339,-0.007596892389386323,0.5129310344827587,0.5414273995077933,6.197947214076247,4.493943748716896,2147,,,"Creatures you control with +1/+1 counters on them have trample. At the beginning of combat on your turn, put a +1/+1 counter on target creature you control.",https://scryfall.com/card/msh/192/training-regimen?utm_source=api,https://cards.scryfall.io/small/front/a/2/a27aee6d-1fc3-4307-bb16-b964d723fe2f.jpg?1780920120
msh,179,Powerful Broker,{2}{G},3.0,Creature — Human Villain,common,G,13.0,0.5245447347585115,-0.024245480609741632,0.5220657276995305,0.5263518138261465,10.55,7.194722181498314,2526,,,"{T}: For each kind of counter on target permanent or player, give that permanent or player another counter of that kind. Activate only as a sorcery.",https://scryfall.com/card/msh/179/powerful-broker?utm_source=api,https://cards.scryfall.io/small/front/8/0/801f0417-b663-4e28-9a61-9570061654d7.jpg?1780920030
msh,183,Restorative Technique,{2}{G},3.0,Sorcery,common,G,12.2,0.5222780569514238,0.005221982185068641,0.504601226993865,0.535990481856038,9.933948229693543,6.64124083053587,2985,,,"Target player gains 2 life, then searches their library for a basic land card, puts it onto the battlefield tapped, then shuffles. Put a +1/+1 counter on up to one target creature.",https://scryfall.com/card/msh/183/restorative-technique?utm_source=api,https://cards.scryfall.io/small/front/d/b/dbe9102d-b92b-4c32-93f6-5b6dc0fa08e6.jpg?1780920044
msh,189,Super Strength,{4}{G},5.0,Enchantment — Aura,common,G,10.0,0.5192604006163328,0.044002668657569965,,,12.13370230119429,8.187063286085047,649,,,"Enchant creature Enchanted creature gets +4/+4 and has trample and ward {1}. (Whenever enchanted creature becomes the target of a spell or ability an opponent controls, counter it unless that player pays {1}.)",https://scryfall.com/card/msh/189/super-strength?utm_source=api,https://cards.scryfall.io/small/front/1/d/1d24d200-63d4-44cf-8d3a-6c6ece5e16ff.jpg?1780920111
msh,163,Claim the Kingdom,{1}{G},2.0,Enchantment — Plan,uncommon,G,8.9,0.5163563160543533,-0.006551021182987449,0.5368663594470046,0.5004468275245755,6.2830609212481425,4.557349896480331,1987,,,"Landfall — Whenever a land you control enters, put a +1/+1 counter on target creature you control and a plan counter on this enchantment. When the fourth plan counter is put on this enchantment, sacrifice it. When you do, put an indestructible counter on target creature you control.",https://scryfall.com/card/msh/163/claim-the-kingdom?utm_source=api,https://cards.scryfall.io/small/front/c/f/cf13bfb1-5b44-4363-8de9-ece234233870.jpg?1780572431
msh,162,Call Damage Control,{1}{G},2.0,Sorcery,common,G,4.1,0.5029411764705882,-0.0304186329019297,0.4755927475592748,0.5228891149542217,11.259632334424579,7.795305800045137,1700,,,Choose up to two. Return those cards from your graveyard to your hand. • Target artifact card. • Target creature card. • Target enchantment card. • Target land card.,https://scryfall.com/card/msh/162/call-damage-control?utm_source=api,https://cards.scryfall.io/small/front/d/e/de1ed886-c33b-4cfd-8442-944cec654a8b.jpg?1780919973
msh,231,The Super Hero Civil War,{3}{R}{W},5.0,Enchantment — Saga,rare,RW,99.6,0.7017474185861795,0.1511285674278171,0.686491935483871,0.7116644823066841,1.7266331658291458,1.7736351531291612,2518,,,"(As this Saga enters and after your draw step, add a lore counter. Sacrifice after III.) I — Gain control of up to two target creatures with total mana value 6 or less for as long as this Saga remains on the battlefield. II — Creatures you control get +1/+1 and gain vigilance until end of turn. III — Target creature you control fights up to one other target creature.",https://scryfall.com/card/msh/231/the-super-hero-civil-war?utm_source=api,https://cards.scryfall.io/small/front/f/b/fbd1f333-5640-41f8-b9dd-1c322ac7724a.jpg?1780539596
msh,18,Jennifer Walters // The Sensational She-Hulk,{1}{W} // {3}{G}{W}{W},2.0,Legendary Creature — Human Advisor Hero // Legendary Creature — Gamma Hero,mythic,WG,98.1,0.6527777777777778,0.08703102453102451,,0.6624203821656051,1.4962025316455696,1.5323383084577114,1008,,,"Your opponents can't cast spells during your turn. {3}{G}{W}{W}: Transform Jennifer Walters. Activate only as a sorcery. // Reach, trample Your opponents can't cast spells during your turn. Whenever a creature you control is dealt damage, you may have The Sensational She-Hulk deal that much damage to any target. Do this only once each turn.",https://scryfall.com/card/msh/18/jennifer-walters-the-sensational-she-hulk?utm_source=api,https://cards.scryfall.io/small/front/6/1/61237530-ad49-469c-a952-67c92315708e.jpg?1780666746
msh,219,"King T'Challa // Black Panther, Hope Enduring",{1}{W}{U} // {4}{W}{U},3.0,Legendary Creature — Human Noble Hero // Legendary Creature — Human Warrior Hero,mythic,UW,96.7,0.6416539050535988,0.07578359788636324,,0.6431226765799256,1.5806451612903225,1.6321167883211678,1306,,,"Flash Whenever a player draws their second card each turn, you draw a card. {4}{W}{U}: Transform King T'Challa. Activate only as a sorcery. // Flash Double strike Prevent all damage that would be dealt to Black Panther. Whenever Black Panther deals combat damage to a player, draw a card.",https://scryfall.com/card/msh/219/king-tchalla-black-panther-hope-enduring?utm_source=api,https://cards.scryfall.io/small/front/a/d/add7d3ce-aa58-4da0-8c2a-cfd01c3a8975.jpg?1780629578
msh,23,"Monica Rambeau // Photon, Living Light",{2}{W} // {2}{R}{W}{W},3.0,Legendary Creature — Human Hero // Legendary Creature — Elemental Hero,mythic,WR,96.3,0.6406660823838738,0.09887933886802369,,0.6628571428571428,1.5108225108225108,1.534621578099839,1141,,,"Flying, prowess (Whenever you cast a noncreature spell, this creature gets +1/+1 until end of turn.) {2}{R}{W}{W}: Transform Monica Rambeau. Activate only as a sorcery. // Flying, hexproof, prowess Whenever you cast a noncreature spell, put a +1/+1 counter on each other creature you control.",https://scryfall.com/card/msh/23/monica-rambeau-photon-living-light?utm_source=api,https://cards.scryfall.io/small/front/3/f/3f995518-b12a-4623-9ab3-b79a5cef3cba.jpg?1780463659
msh,237,Vision Quest,{X}{U}{R},2.0,Sorcery,rare,RU,95.9,0.6379417234965902,0.09629583820980714,0.6020066889632107,0.6591133004926109,4.308169596690797,3.95,1613,,,"Search your library and/or graveyard for an artifact creature card with mana value X or less and put it onto the battlefield with X additional +1/+1 counters on it. If X is 4 or greater, it gains haste until end of turn. If you search your library this way, shuffle.",https://scryfall.com/card/msh/237/vision-quest?utm_source=api,https://cards.scryfall.io/small/front/c/0/c01afea6-645d-4d4f-bdaa-90794a628bcd.jpg?1780920186
msh,222,"The Mighty Thor, Jane Foster",{1}{W}{U},3.0,Legendary Creature — Human God Hero,rare,UW,95.6,0.6374485596707818,0.05286690092032509,0.6397849462365591,0.636,2.2865853658536586,2.379258517034068,2430,,,"Flying Whenever The Mighty Thor attacks, exile up to one target nontoken artifact or creature, then return that card to the battlefield tapped under its owner's control. Whenever an Equipment you control enters, draw a card.",https://scryfall.com/card/msh/222/the-mighty-thor-jane-foster?utm_source=api,https://cards.scryfall.io/small/front/0/8/082cc8cc-bbea-4ca7-a0e8-da1f865d6626.jpg?1780657826
msh,212,The Coming of Galactus,{2}{B}{B}{G},5.0,Enchantment — Saga,mythic,BG,95.2,0.6361031518624641,0.11613273766128074,,0.6412556053811659,1.5221238938053097,1.6458885941644563,1047,,,"(As this Saga enters and after your draw step, add a lore counter. Sacrifice after IV.) I — Destroy up to one target nonland permanent. II, III — Each opponent loses 2 life. IV — Create Galactus, a legendary 16/16 black Elder Alien creature token with flying, trample, and ""Whenever Galactus attacks, destroy target land.""",https://scryfall.com/card/msh/212/the-coming-of-galactus?utm_source=api,https://cards.scryfall.io/small/front/0/4/04a38b92-619e-4fe8-b0cb-6fa31f0824ff.jpg?1778243954
msh,230,"Storm, Windrider",{1}{G}{W}{W},4.0,Legendary Creature — Mutant Hero,rare,GW,94.4,0.6302715193529752,0.07879472610403004,0.6246200607902735,0.6337371854613234,2.3862815884476536,2.4503345342254246,1731,,,"Flying Creatures with flying can't attack you or block creatures you control. Whenever you cast a spell that targets one or more creatures, those creatures gain flying until end of turn.",https://scryfall.com/card/msh/230/storm-windrider?utm_source=api,https://cards.scryfall.io/small/front/e/9/e90196a9-5a76-42f8-9b40-097d02b47f33.jpg?1780572941
msh,240,"Wolverine, Fierce Fighter",{2}{R}{G},4.0,Legendary Creature — Mutant Berserker Hero,rare,GR,94.1,0.6299065420560748,0.1022488065331707,0.6207430340557275,0.6360792492179353,2.153012048192771,2.235733333333333,1605,,,"Haste When Wolverine enters, he fights up to one other target creature. If damage would be dealt to Wolverine, instead that damage is dealt, but all other damage already dealt to him is healed.",https://scryfall.com/card/msh/240/wolverine-fierce-fighter?utm_source=api,https://cards.scryfall.io/small/front/c/1/c1c7aa22-51b0-45ee-9a8e-5493a1820d8c.jpg?1780458400
msh,205,Avengers: Under Siege,{2}{B}{R},4.0,Enchantment — Saga,rare,BR,93.7,0.6296498905908097,0.11367007562024622,0.6262203626220363,0.6318631863186318,2.376248612652608,2.3778204512722034,1828,,,"(As this Saga enters and after your draw step, add a lore counter. Sacrifice after III.) I — Create two 2/1 black Villain creature tokens with menace. II — This Saga deals 2 damage to each non-Villain creature and each opponent. III — Create a Treasure token for each Villain you control.",https://scryfall.com/card/msh/205/avengers:-under-siege?utm_source=api,https://cards.scryfall.io/small/front/3/c/3c379a3f-bde1-4dc1-9843-afcb5f40792f.jpg?1781065596
msh,211,"Cloak and Dagger, Entwined",{1}{W}{B},3.0,Legendary Creature — Human Hero,rare,BW,92.2,0.623750734861846,0.08517930629041737,0.6002994011976048,0.6389157792836399,2.784180790960452,2.729329852045257,1701,,,"Deathtouch, lifelink When Cloak and Dagger enter, choose target opponent and up to one target creature they control. They reveal their hand. You may exile a nonland card from their hand or the chosen creature until Cloak and Dagger leave the battlefield.",https://scryfall.com/card/msh/211/cloak-and-dagger-entwined?utm_source=api,https://cards.scryfall.io/small/front/f/a/fa01d35f-1064-4a7c-9475-4504566df850.jpg?1780920153
msh,218,"Killmonger, Scourge of Wakanda",{2}{B}{G},4.0,Legendary Creature — Human Mercenary Villain,uncommon,BG,91.9,0.6233092876465284,0.08698672942615993,0.6009148084619783,0.6378861183475996,4.574946004319655,4.066051873198847,4436,,,"When Killmonger enters, you may sacrifice another creature. When you do, destroy target nonland permanent an opponent controls. As long as there are two or more creature cards in your graveyard, Killmonger gets +2/+1.",https://scryfall.com/card/msh/218/killmonger-scourge-of-wakanda?utm_source=api,https://cards.scryfall.io/small/front/5/0/5060aa13-4b33-4b3a-8bdb-dd81308fa3e3.jpg?1780413784
msh,49,Bruce Banner // The Incredible Hulk,{U} // {2}{R}{R}{G}{G},1.0,Legendary Creature — Human Scientist Hero // Legendary Creature — Gamma Berserker Hero,mythic,UGR,91.1,0.6187904967602592,0.08194839149710131,,0.6003552397868561,1.7936117936117937,1.8789893617021276,926,,,"{X}{X}, {T}: Draw X cards. Activate only as a sorcery. {2}{R}{R}{G}{G}: Transform Bruce Banner. Activate only as a sorcery. // Reach, trample Enrage — Whenever The Incredible Hulk is dealt damage, put a +1/+1 counter on him. If he's attacking, untap him and there is an additional combat phase after this phase.",https://scryfall.com/card/msh/49/bruce-banner-the-incredible-hulk?utm_source=api,https://cards.scryfall.io/small/front/e/0/e0dbbdcf-84e1-494f-8b8c-0a094f603fa9.jpg?1778243776
msh,80,Tony Stark // The Invincible Iron Man,{1}{U} // {4}{U}{R},2.0,Legendary Creature — Human Artificer Hero // Legendary Artifact Creature — Human Hero,mythic,UR,90.0,0.6167146974063401,0.0844993399482642,,0.62402496099844,2.018390804597701,2.106904231625835,1041,,,"{1}, {T}: Look at the top four cards of your library. You may reveal an artifact card from among them and put it into your hand. Put the rest on the bottom of your library in a random order. {4}{U}{R}: Transform Tony Stark. Activate only as a sorcery. // Flying, haste At the beginning of combat on your turn, you may put an artifact card from your hand onto the battlefield. If it's an Equipment, attach it to The Invincible Iron Man.",https://scryfall.com/card/msh/80/tony-stark-the-invincible-iron-man?utm_source=api,https://cards.scryfall.io/small/front/4/c/4cea42fd-035e-4b8f-8b1d-ff363b694f14.jpg?1780463636
msh,224,The Ruinous Wrecking Crew,{X}{B}{R},2.0,Legendary Creature — Human Villain,rare,BR,89.6,0.6163915765509391,0.13459885946410438,0.6118326118326118,0.6193609022556391,2.6379310344827585,2.5346715328467155,1757,,,"The Ruinous Wrecking Crew enters with X +1/+1 counters on it. When The Ruinous Wrecking Crew enters, choose up to X — • Discard a card, then draw a card. • Target opponent loses 2 life. • Destroy target token. • Each player sacrifices a creature of their choice.",https://scryfall.com/card/msh/224/the-ruinous-wrecking-crew?utm_source=api,https://cards.scryfall.io/small/front/4/d/4d8c8ceb-84cd-46d2-9230-ab6ca4569334.jpg?1780539580
msh,199,Absorbing Man,{1}{G}{U},3.0,Legendary Creature — Human Villain,rare,GU,88.5,0.6129905277401895,0.05895012369978547,0.6338983050847458,0.5990990990990991,3.678240740740741,3.5107564191533656,1478,,,"Vigilance At the beginning of your first main phase, until your next turn, Absorbing Man becomes a copy of up to one target artifact, non-Aura enchantment, or land, except his name is Absorbing Man, he's a legendary 4/4 Human Villain creature in addition to his other types, and he has vigilance.",https://scryfall.com/card/msh/199/absorbing-man?utm_source=api,https://cards.scryfall.io/small/front/7/1/7114ef87-53ff-43e9-864c-9faa455d86ef.jpg?1780572929
msh,213,"Daredevil, Man Without Fear",{2}{R}{W},4.0,Legendary Creature — Human Hero,rare,RW,87.0,0.610738255033557,0.053037105608269686,0.5778097982708934,0.6316270566727605,2.4885057471264367,2.487942534633145,1788,,,"Vigilance, haste Radar Sense — You may look at the top card of your library any time. Whenever you attack, you may exile the top card of your library. If that card is a Hero card, Daredevil gets +2/+1 until end of turn. You may play that card this turn.",https://scryfall.com/card/msh/213/daredevil-man-without-fear?utm_source=api,https://cards.scryfall.io/small/front/1/4/14e821bb-55cc-474e-9b63-0ceecc2666c1.jpg?1780539551
msh,239,"Winter Soldier, Icy Assassin",{W}{B},2.0,Legendary Creature — Human Assassin Villain,rare,BW,84.1,0.6063268892794376,0.08319521668157281,,0.5996978851963746,4.41542288557214,3.937875751503006,1138,,,"Vigilance, menace Winter Soldier gets +2/+0 for each Equipment attached to him. {3}{W}{B}: Return this card from your graveyard to the battlefield with a finality counter on him. Then you may attach an Equipment you control to him. (If a creature with a finality counter on it would die, exile it instead.)",https://scryfall.com/card/msh/239/winter-soldier-icy-assassin?utm_source=api,https://cards.scryfall.io/small/front/e/b/ebf71ffc-6e3e-4ca0-a84a-3c1ebd2b64b1.jpg?1780572962
msh,229,"Spider-Woman, Secret Agent",{3}{W/U},4.0,Legendary Creature — Spider Human Spy Hero,uncommon,UW,82.2,0.6031899468342194,0.023343548529134672,0.5697429414243573,0.6238914971309337,3.7445520581113803,3.1451545820047135,6207,,,"Flash When Spider-Woman enters, tap target creature an opponent controls. That creature can't become untapped for as long as you control Spider-Woman.",https://scryfall.com/card/msh/229/spider-woman-secret-agent?utm_source=api,https://cards.scryfall.io/small/front/a/0/a0325cb5-4c43-418a-8f1b-cf5bf29e74d7.jpg?1780413818
msh,210,"Captain America, Living Legend",{1}{W}{U},3.0,Legendary Creature — Human Soldier Hero,uncommon,UW,81.5,0.6023391812865497,0.023247493197432356,0.5916897506925207,0.608783104257459,4.864081806561568,4.157870791628754,4788,,,"Vigilance Whenever a creature you control becomes tapped during your turn, if it's the first time that creature has become tapped this turn, untap it.",https://scryfall.com/card/msh/210/captain-america-living-legend?utm_source=api,https://cards.scryfall.io/small/front/6/5/6516f292-469d-4092-b099-97c698f373cd.jpg?1780413757
msh,236,"U.S.Agent, John Walker",{3}{W/B},4.0,Legendary Creature — Human Soldier Hero,uncommon,BW,67.0,0.5805550381821568,0.00855205977560436,0.5445026178010471,0.6037331701346389,4.251921434671221,3.494394480719478,5369,,,"When U.S.Agent enters, create a colorless Equipment artifact token named Sturdy Shield with ""Equipped creature gets +1/+2"" and equip {2}. Attach it to U.S.Agent.",https://scryfall.com/card/msh/236/usagent-john-walker?utm_source=api,https://cards.scryfall.io/small/front/3/5/35e11911-799c-4d82-9109-3ca27964bef0.jpg?1780572955
msh,207,"Black Panther, Vanguard",{2}{G}{W},4.0,Legendary Creature — Human Warrior Hero,uncommon,GW,65.9,0.5800144822592325,0.003347815592565806,0.5674556213017752,0.5886669384427232,4.581329561527581,3.8767455980570733,4143,,,"Whenever another nontoken Hero you control enters, choose one — • Create a 1/1 white Soldier creature token. • Creatures you control get +1/+1 until end of turn.",https://scryfall.com/card/msh/207/black-panther-vanguard?utm_source=api,https://cards.scryfall.io/small/front/9/e/9e308f77-206b-4c9d-bfba-f4c476ea574a.jpg?1780413744
msh,204,The Astonishing Ant-Man,{G}{U},2.0,Legendary Creature — Human Scientist Hero,rare,GU,62.2,0.5768667642752562,0.04301114032450071,0.6031746031746031,0.55819774718398,3.002706359945873,2.895559210526316,1366,,,"Whenever you draw a card, put a +1/+1 counter on The Astonishing Ant-Man. {2}{G}, {T}, Remove any number of +1/+1 counters from The Astonishing Ant-Man: Create that many 1/1 green Insect creature tokens.",https://scryfall.com/card/msh/204/the-astonishing-ant-man?utm_source=api,https://cards.scryfall.io/small/front/5/d/5d98073e-2828-4365-a8d6-f631aac0cca9.jpg?1780658586
msh,198,"Abomination, Terrifying Titan",{3}{R/G},4.0,Legendary Creature — Gamma Villain,uncommon,GR,55.9,0.5691710562794566,0.023151405186615293,0.5372628726287263,0.5912717034256217,4.624927870744374,3.557652752571083,3607,,,Trample Power-up — {5}{R/G}{R/G}: Put a +1/+1 counter on Abomination. He fights up to one target creature an opponent controls. (Activate each power-up ability only once. Reduce the cost by his mana cost if he entered this turn.),https://scryfall.com/card/msh/198/abomination-terrifying-titan?utm_source=api,https://cards.scryfall.io/small/front/2/c/2c6ab9bb-dba2-4b5b-a4d9-54735f65ac21.jpg?1780572916
msh,202,"Ares, God of War",{1}{B}{R},3.0,Legendary Creature — God Warrior Villain,rare,BR,52.2,0.5653153153153153,0.06129552558123985,0.5657142857142857,0.5650557620817844,2.760839160839161,2.8831615120274914,1332,,,"Ares attacks each combat if able. Whenever an attacking creature you control dies, return that card to its owner's hand.",https://scryfall.com/card/msh/202/ares-god-of-war?utm_source=api,https://cards.scryfall.io/small/front/3/e/3e121d65-d341-40b9-bebc-1e7d1b83905c.jpg?1780658544
msh,223,Moon Girl and Devil Dinosaur,{1}{G}{U},3.0,Legendary Creature — Human Dinosaur Hero,rare,GU,50.7,0.5628378378378378,-0.0002056404230317277,0.5843478260869566,0.549171270718232,3.1281138790035588,3.1047693510555123,1480,,,"Whenever you draw your second card each turn, until end of turn, Moon Girl and Devil Dinosaur's base power and toughness become 6/6 and they gain trample. Whenever an artifact you control enters, draw a card. This ability triggers only once each turn.",https://scryfall.com/card/msh/223/moon-girl-and-devil-dinosaur?utm_source=api,https://cards.scryfall.io/small/front/8/c/8c6a6d11-45cb-4def-a04b-51b91e1747db.jpg?1778243969
msh,228,"Spider-Man, To the Rescue",{2}{G/W},3.0,Legendary Creature — Spider Human Hero,uncommon,GW,50.4,0.5622927522501184,-0.006932802740561073,0.551605504587156,0.5698143664245359,4.09100310237849,3.2374768089053805,4222,,,"Flash Vigilance, reach No One Dies! — When Spider-Man enters, you may tap him. When you do, another target nonattacking creature you control gains indestructible until end of turn. (Damage and effects that say ""destroy"" don't destroy it.)",https://scryfall.com/card/msh/228/spider-man-to-the-rescue?utm_source=api,https://cards.scryfall.io/small/front/e/5/e5db6968-1ca3-46bd-8cf9-e2c411ab29c1.jpg?1780920173
msh,232,"Taskmaster, Mercenary Mimic",{2}{U}{B},4.0,Legendary Creature — Human Mercenary Villain,rare,BU,47.8,0.5603271983640081,0.03570713757373456,0.538160469667319,0.5721757322175732,3.5642384105960265,3.2081756245268735,1467,,,"Photographic Reflexes — At the beginning of your first main phase, until your next turn, Taskmaster becomes a copy of up to one target creature on the battlefield or creature card in a graveyard, except his name is Taskmaster, Mercenary Mimic and he's a legendary Human Mercenary Villain creature.",https://scryfall.com/card/msh/232/taskmaster-mercenary-mimic?utm_source=api,https://cards.scryfall.io/small/front/0/d/0d4265fd-cbfa-4e57-89fd-a1d757acfe81.jpg?1780925794
msh,235,"Titania, Rugged Rumbler",{2}{B/G},3.0,Legendary Creature — Human Villain,uncommon,BG,47.0,0.5601436265709157,0.03903702032240619,0.5616045845272206,0.5590955806783144,4.910209102091021,3.8061714285714285,3342,,,"As an additional cost to cast this spell, discard a card or pay {2}. Ward—Discard a card or pay {2}. (Whenever this creature becomes the target of a spell or ability an opponent controls, counter it unless that player discards a card or pays {2}.)",https://scryfall.com/card/msh/235/titania-rugged-rumbler?utm_source=api,https://cards.scryfall.io/small/front/c/2/c281e0ee-155b-4022-b921-ebc391535aad.jpg?1780629742
msh,220,The Kingpin of Crime,{1}{W}{B},3.0,Legendary Creature — Human Villain,rare,BW,45.9,0.5569023569023569,0.008496559800907577,0.5297202797202797,0.5739320920043811,3.8142201834862384,3.5609065155807365,1485,,,"Extort (Whenever you cast a spell, you may pay {W/B}. If you do, each opponent loses 1 life and you gain that much life.) Whenever you attack, you may pay 2 life. If you do, until end of turn, creatures you control with toughness greater than their power assign combat damage equal to their toughness rather than their power.",https://scryfall.com/card/msh/220/the-kingpin-of-crime?utm_source=api,https://cards.scryfall.io/small/front/4/9/495c08ea-5502-4bfe-aa15-fa85556755ae.jpg?1780413804
msh,208,"Black Widow, Double Agent",{1}{W}{B},3.0,Legendary Creature — Human Hero Villain,uncommon,BW,44.8,0.5557932263814617,0.009126559714795035,0.532093023255814,0.5705202312138729,6.046499198289685,4.819788338658147,2805,,,"Deathtouch Whenever a creature you control attacks alone, it gains first strike and menace until end of turn. (It can't be blocked except by two or more creatures.)",https://scryfall.com/card/msh/208/black-widow-double-agent?utm_source=api,https://cards.scryfall.io/small/front/a/a/aa8dbbb9-36a5-48e0-9e30-aeed0fb5d522.jpg?1780413750
